<?xml version="1.0" encoding="UTF-8"?>
<!DOCTYPE recipe SYSTEM "../recipes.dtd">
<recipe>
	<title>French Crullers</title>
	<meta>
		<dishtype>Donuts</dishtype>
	</meta>
    <ingredients>
        <ingredient>
            <item>choux dough</item>
        </ingredient>
        <ingredient>
            <item>shortening for frying</item>
        </ingredient>
    </ingredients>
    <steps>
        <step>Prepare the choux dough.</step>
        <step>Put the dough in a <equipment>pastry bag</equipment> fitted with a <equipment>half-inch star tip</equipment>.</step>
        <step>Cut a few 10 cm squares of <equipment>parchment paper</equipment>.</step>
        <step>Add enough shortening to a pan or fryer to cover the donuts when melted (about 5 cm deep). Heat to <temperature>370</temperature>.</step>
        <step>Using <equipment>tongs</equipment>, dip the parchment squares in the oil and remove to a surface.</step>
        <step>Pipe circles of choux dough on the parchment squares.</step>
        <step>Gently set dough on their parchment in shortening a few at a time, leaving room for expansion. Remove the parchment with tongs to use for next set of donuts, and <procedure>deep fry</procedure> until light brown, about <time>1 minute</time>. Turn over, and fry until second side browns, another <time>1 minute</time>.</step>
        <step>Remove to the wire rack and let cool while frying the remainder.</step>
    </steps>
	<serving>Cool and cover on both sides with confectioners' sugar glaze.</serving>
	<storage>Donuts don't store well, but can be frozen. Freeze the day they are made.</storage>
</recipe>
