<?xml version="1.0" encoding="UTF-8"?>
<!DOCTYPE recipe SYSTEM "../recipes.dtd">
<recipe>
	<title>Stollen</title>
	<meta>
		<cuisine>German</cuisine>
		<dishtype>Cakes</dishtype>
		<dishtype>Breads</dishtype>
		<occasion>Christmas</occasion>
	</meta>
	<group>
		<label>Fruit mixture</label>
		<ingredients>
			<ingredient>
				<quantity>
					<value>170</value>
					<unit>g</unit>
					<altmeasure>
						<quantity>
							<value>1</value>
							<unit>cup</unit>
						</quantity>
					</altmeasure>
				</quantity>
				<item>candied citrus peel</item>
				<note>Use any mix of orange, lemon, and citron. Beware of colourful "mixed peels" whose primary ingredient is actually rutabaga. (!)</note>
			</ingredient>
			<ingredient>
				<quantity>
					<value>170</value>
					<unit>g</unit>
					<altmeasure>
						<quantity>
							<value>1</value>
							<unit>cup</unit>
						</quantity>
					</altmeasure>
				</quantity>
				<item>raisins</item>
			</ingredient>
			<ingredient>
				<quantity>
					<value>115</value>
					<unit>g</unit>
					<altmeasure>
						<quantity>
							<value>1/2</value>
							<unit>cup</unit>
						</quantity>
					</altmeasure>
				</quantity>
				<item>brandy</item>
			</ingredient>
			<ingredient>
				<quantity>
					<value>15</value>
					<unit>g</unit>
					<altmeasure>
						<quantity>
							<value>1</value>
							<unit>tbs</unit>
						</quantity>
					</altmeasure>
				</quantity>
				<item>orange extract</item>
			</ingredient>
		</ingredients>
		<steps>
			<step>Combine all ingredients in a bowl and cover.</step>
			<step>Let fruit absorb liquid for <time>2 days</time>, stirring occasionally. The fruit will absorb nearly all of it.</step>
		</steps>
	</group>
	<group>
		<label>Sponge</label>
		<ingredients>
			<ingredient>
				<quantity>
					<value>150</value>
					<unit>g</unit>
					<altmeasure>
						<quantity>
							<value>2/3</value>
							<unit>cup</unit>
						</quantity>
					</altmeasure>
				</quantity>
				<item>milk</item>
			</ingredient>
			<ingredient>
				<quantity>
					<value>90</value>
					<unit>g</unit>
					<altmeasure>
						<quantity>
							<value>3/4</value>
							<unit>cup</unit>
						</quantity>
					</altmeasure>
				</quantity>
				<variant>bread</variant>
				<item>flour</item>
			</ingredient>
			<ingredient>
				<quantity>
					<value>8</value>
					<unit>g</unit>
					<altmeasure>
						<quantity>
							<value>2</value>
							<unit>tsp</unit>
						</quantity>
					</altmeasure>
				</quantity>
				<variant>osmotolerant</variant>
				<item>yeast</item>
				<note>If you don't have osmotolerant yeast, double the rising times (except for the sponge phase).</note>
			</ingredient>
		</ingredients>
		<steps>
			<step>Combine ingredients in a stand mixer fitted with the paddle blade. Mix together until well developed, <time>5 minutes</time>.</step>
			<step>Cover, put in a warm spot and <procedure>proof</procedure> for <time>1 hour</time>.</step>
		</steps>
	</group>
	<group>
		<label>Dough</label>
		<ingredients>
			<ingredient>
				<quantity>
					<value>175</value>
					<unit>g</unit>
					<altmeasure>
						<quantity>
							<value>3/4</value>
							<unit>cup</unit>
						</quantity>
					</altmeasure>
				</quantity>
				<item>butter</item>
			</ingredient>
			<ingredient>
				<quantity>
					<value>30</value>
					<unit>g</unit>
					<altmeasure>
						<quantity>
							<value>2</value>
							<unit>tbs</unit>
						</quantity>
					</altmeasure>
				</quantity>
				<item>sugar</item>
			</ingredient>
			<ingredient>
				<quantity>
					<value>5</value>
					<unit>g</unit>
					<altmeasure>
						<quantity>
							<value>3/4</value>
							<unit>tsp</unit>
						</quantity>
					</altmeasure>
				</quantity>
				<item>salt</item>
			</ingredient>
			<ingredient>
				<quantity>
					<value>4</value>
					<unit>g</unit>
					<altmeasure>
						<quantity>
							<value>3/4</value>
							<unit>tsp</unit>
						</quantity>
					</altmeasure>
				</quantity>
				<item>vanilla extract</item>
			</ingredient>
			<ingredient>
				<quantity>
					<value>30</value>
					<unit>g</unit>
					<altmeasure>
						<quantity>
							<value>2</value>
							<unit>tbs</unit>
						</quantity>
					</altmeasure>
				</quantity>
				<item><reciperef ref="almond-paste">almond paste</reciperef></item>
			</ingredient>
			<ingredient>
				<quantity>
					<value>260</value>
					<unit>g</unit>
					<altmeasure>
						<quantity>
							<value>2</value>
							<unit>cups</unit>
						</quantity>
					</altmeasure>
				</quantity>
				<variant>bread</variant>
				<item>flour</item>
			</ingredient>
		</ingredients>
		<steps>
			<step>Still in the stand mixer with the paddle attachment, add all ingredients to the sponge except flour above and mix until smoothly combined.</step>
			<step>Add the flour. Mix to knead the dough extremely well, about <time>30 minutes</time>. Dough should form a satiny smooth mass.</step>
			<step>Cover, put in a warm spot, and <procedure>proof</procedure> again until doubled, about <time>1 hour</time>.</step>
		</steps>
	</group>
	<group>
		<label>Shaping</label>
		<ingredients>
			<ingredient mainingredient="true">
				<quantity>
					<value>175</value>
					<unit>g</unit>
					<altmeasure>
						<quantity>
							<value>2/3</value>
							<unit>cup</unit>
						</quantity>
					</altmeasure>
				</quantity>
				<item><reciperef ref="almond-paste">almond paste</reciperef></item>
			</ingredient>
		</ingredients>
		<steps>
			<step>Drain the residual liquid well from the dried fruits and retain.</step>
			<step>Roll out the dough and spread the drained fruits over it. Fold the dough over and gently knead in the fruits just until evenly dispersed.</step>
			<step>Let dough rest <time>10 minutes</time>. Meanwhile, divide the almond paste in half and roll each half into a log about 9 inches long.</step>
			<step>Divide the dough in two pieces. Roll each piece to a 10 x 10 inch square, making it thin in the middle and thicker on the two edges.</step>
			<step>Place a log of almond paste in the thin section. Fold over one thick edge and place on top of the almond paste, beside the other thick edge, so the thin section fully wraps around the almond paste. The cake should now have two sides that are about equally thick, and a mound in the centre. Seal all the dough edges.</step>
			<step>Grease a <equipment>baking sheet</equipment> or line with parchment paper. Transfer the cakes to the sheet, spaced somewhat apart. Cover with plastic or a kitchen towel. Let rise about <time>1 1/2 hours</time>, until it grows to at least one and half times in size.</step>
			<step>Preheat the oven to <temperature>350</temperature>. Bake about <time>30 minutes</time> until mahogany brown.</step>
		</steps>
	</group>
	<group>
		<label>Finishing</label>
		<ingredients>
			<ingredient>
				<quantity>
					<value>113</value>
					<unit>g</unit>
					<altmeasure>
						<quantity>
							<value>1/2</value>
							<unit>cup</unit>
						</quantity>
					</altmeasure>
				</quantity>
				<item>butter</item>
			</ingredient>
			<ingredient>
				<item>reserved liquor from fruits</item>
			</ingredient>
			<ingredient>
				<variant>confectioner's</variant>
				<item>sugar</item>
			</ingredient>
		</ingredients>
		<steps>
			<step>While the cakes bake, <procedure>clarify</procedure> the butter.</step>
			<step>When cakes are done, remove to a wire rack. Brush immediately all over with the reserved fruit liquor, then brush immediately all over with the clarified butter.</step>
			<step>Let cool completely, then dust well in confectioner's sugar.</step>
			<step>Leave out overnight to dry slightly.</step>
			<step>Place in airtight plastic and let mellow at room temperature up to one month.</step>
		</steps>
	</group>
</recipe>
