<?xml version="1.0" encoding="UTF-8"?>
<!DOCTYPE recipe SYSTEM "../recipes.dtd">
<recipe>
	<title>Raised Coffee Cake</title>
	<meta>
		<source>Marion Cunningham: The Fannie Farmer Cookbook, 13th Edition (1994: Knopf) (adapted)</source>
		<dishtype>Breakfast</dishtype>
		<occasion>Sunday Brunch</occasion>
		<comment>Raised coffee cake is the most refined version. Although it is yeast-raised like bread, the recipe forms a batter instead of a dough. The extensible batter becomes very airy during the rising process. The poolish gives a more complex flavour to the cake that really makes it, but it can be skipped; simply add the poolish ingredients with the other cake ingredients.</comment>
	</meta>
	<group>
		<label>Poolish</label>
		<ingredients>
			<ingredient>
				<quantity>
					<value>100</value>
					<unit>g</unit>
					<altmeasure>
						<quantity>
							<value>1/2</value>
							<unit>cup</unit>
						</quantity>
					</altmeasure>
				</quantity>
				<item>water</item>
			</ingredient>
			<ingredient>
				<quantity>
					<value>100</value>
					<unit>g</unit>
					<altmeasure>
						<quantity>
							<value>3/4</value>
							<unit>cup</unit>
						</quantity>
					</altmeasure>
				</quantity>
				<variant>all purpose</variant>
				<item>flour</item>
			</ingredient>
			<ingredient>
				<quantity>
					<value>.2</value>
					<unit>g</unit>
					<altmeasure>
						<quantity>
							<value>1/16</value>
							<unit>tsp</unit>
						</quantity>
					</altmeasure>
				</quantity>
				<variant>instant</variant>
				<item>yeast</item>
			</ingredient>
		</ingredients>
		<steps>
			<step>Stir ingredients well to make a smooth batter.</step>
			<step>Cover and let rise overnight, <time>8 - 10 hours</time>.</step>
		</steps>
	</group>
	<group>
		<label>Cake</label>
		<ingredients>
			<ingredient>
				<quantity>
					<value>170</value>
					<unit>g</unit>
					<altmeasure>
						<quantity>
							<value>3/4</value>
							<unit>cup</unit>
						</quantity>
					</altmeasure>
				</quantity>
				<item>milk</item>
			</ingredient>
			<ingredient>
				<quantity>
					<value>115</value>
					<unit>g</unit>
					<altmeasure>
						<quantity>
							<value>2</value>
						</quantity>
					</altmeasure>
				</quantity>
				<item>eggs</item>
			</ingredient>
			<ingredient>
				<item>poolish</item>
			</ingredient>
			<ingredient>
				<quantity>
					<value>100</value>
					<unit>g</unit>
					<altmeasure>
						<quantity>
							<value>1/2</value>
							<unit>cup</unit>
						</quantity>
					</altmeasure>
				</quantity>
				<item>sugar</item>
			</ingredient>
			<ingredient>
				<quantity>
					<value>200</value>
					<unit>g</unit>
					<altmeasure>
						<quantity>
							<value>1 2/3</value>
							<unit>cups</unit>
						</quantity>
					</altmeasure>
				</quantity>
				<variant>all purpose</variant>
				<item>flour</item>
			</ingredient>
			<ingredient>
				<quantity>
					<value>3</value>
					<unit>g</unit>
					<altmeasure>
						<quantity>
							<value>1/2</value>
							<unit>tsp</unit>
						</quantity>
					</altmeasure>
				</quantity>
				<item>salt</item>
			</ingredient>
			<ingredient>
				<quantity>
					<value>8</value>
					<unit>g</unit>
					<altmeasure>
						<quantity>
							<value>2</value>
							<unit>tsp</unit>
						</quantity>
					</altmeasure>
				</quantity>
				<variant>instant</variant>
				<item>yeast</item>
			</ingredient>
			<ingredient>
				<quantity>
					<value></value>
					<unit>g</unit>
					<altmeasure>
						<quantity>
							<value>5</value>
							<unit>tbs</unit>
						</quantity>
					</altmeasure>
				</quantity>
				<item>butter</item>
				<preprep>softened</preprep>
			</ingredient>
			<ingredient>
				<quantity>
					<value>300</value>
					<unit>g</unit>
					<altmeasure>
						<quantity>
							<value>2</value>
							<unit>cups</unit>
						</quantity>
					</altmeasure>
				</quantity>
				<item><reciperef ref="streusel">streusel</reciperef></item>
			</ingredient>
		</ingredients>
		<steps>
			<step><procedure>Scald</procedure> the milk and cool to room temperature. Bring butter and eggs to room temperature.</step>
			<step>Add all ingredients except butter to the poolish.</step>
			<step><procedure>Beat</procedure> together well <time>5 minutes</time>, using the paddle attachment if using a stand mixer. This will form a smooth and elastic batter.</step>
			<step>Add the butter and beat in until fully incorporated.</step>
			<step>Cover and set aside to rise until double in bulk, about <time>2 hours</time>.</step>
			<step>Grease well a <equipment>9-inch tube pan</equipment>.</step>
			<step>Stir down the dough until fully collapsed. Spread about half of it in the tube pan. Sprinkle with about 2/3 of the streusel, then cover with the remaining dough.</step>
			<step>Stir streusel and batter together very slighly, only one movement per section of the cake, to streak the streusel through the cake without blending it in.</step>
			<step>Sprinkle the remaining streusel over the top of the cake.</step>
			<step>Cover and set aside to raise until double again, about <time>1 hour</time>.</step>
			<step><time>15 minutes before rising is done, preheat oven to </time> <temperature>350</temperature>.</step>
			<step>Bake for about <time>45 minutes</time>, until brown and done inside.</step>
			<step>Cool on a rack in the pan, then remove from pan.</step>
		</steps>
	</group>
</recipe>
